claim,description,n,support_fraction,ci_low,ci_high,notes
C1,Closed-loop/open-loop divergence,295,0.8576271186440678,0.8135593220338984,0.888135593220339,deployed closed-loop loss gap >5%
C2,Closed-loop stages,295,0.06779661016949153,0.04228813559322037,0.09830508474576272,plateau present plus non-fallback second stage boundary
C2a,Closed-loop slow-progress phase,295,0.9491525423728814,0.9220338983050848,0.9728813559322034,early rapid improvement followed by slow-progress phase
C3,Coupled-system stability transition,295,0.8610169491525423,0.823728813559322,0.8983050847457628,finite coupled spectral radius crossing
C4,Short-term vs long-term tradeoff,295,0.10847457627118644,0.07457627118644068,0.1423728813559322,proxy only: open-loop deployed spike plus closed-loop recovery
C5,Generalization,50,0.76,0.66,0.86,generalization variants preserving deployed-loss divergence
